row_id,tsv_seq,citation_key,year,title,full_name,final_tier,A1_competency_regime,A2_action_abstraction,A2_observation_type,A2_decision_formalism,A3_SPAE_pattern,A3_authority_pattern,A4_assurance_mode,A5_EVL,synthesis_set,_alias_note
26,26,hu2026bayesian,2026,Bayesian RL adaptive energy recuperation,Bayesian reinforcement learning for adaptive control of energy recuperation in hydraulic excavator arms,Tier B,Earthwork and Material Processing,Low-level,Low-dim belief/hydraulic state,POMDP,MB/D/MB/MB,Residual learning within classical control,AM3,L0,Contextual,paper-level check: reviewed in prior evidence pass; classification retained after consistency audit.
27,27,huang2023dexterous,2023,Dexterous manipulation construction tools,Dexterous manipulation of construction tools using anthropomorphic robotic hand,Tier A,Structural Assembly and Installation,Mid-level,Low-dim observation,MDP,MB/D/MB/MB,Bounded skill or supervisory,AM0,L0,Primary,
28,28,huang2023imitate,2023,To imitate or not to imitate,To imitate or not to imitate: Boosting reinforcement learning-based construction robotic control for long-horizon tasks using virtual demonstrations,Tier A,Structural Assembly and Installation,Mid-level,Low-dim VR / object / robot state,MDP,MB/D/MB/MB,Bounded skill or supervisory,AM0,L0,Primary,paper-level check: reviewed in prior evidence pass; classification retained after consistency audit.
29,29,Jang2026,2026,Anti-swing overhead crane multi-body dynamics,Anti-swing overhead crane control algorithm based on multi-body dynamics using reinforcement learning,Tier B,Material Placement and Lifting,Mid-level,Low-dim crane/load dynamic state,MDP,MB/D/MB/MB,Bounded skill or supervisory,AM0,L0,Contextual,paper-level check: reviewed in prior evidence pass; classification retained after consistency audit.
30,30,jin2023learning,2023,Learning excavation rigid objects offline,Learning excavation of rigid objects with offline reinforcement learning,Tier A,Earthwork and Material Processing,Mid-level,Low-dim bucket pose/velocity/contact-force state,MDP,MB/D/MB/MB,Bounded skill or supervisory,AM2,L2,Primary,paper-level check: reviewed in prior evidence pass; classification retained after consistency audit.
31,31,jin2025path,2025,Path Planning Building Robots,Path Planning and Control of Building Robots Based on Reinforcement Learning Algorithm in Intelligent Construction,Tier B,"Navigation, Layout, and Logistics Support",Mid-level,Low-dim discrete grid-style state capturing robot and goal coordinates relative to randomly placed static obstacles and moving barriers in a ten-by-ten meter simulated intelligent construction scene used for tabular Q-learning updates without embodied sensing stack,MDP,D/D/MB/MB,Residual learning within classical control,AM0,L0,Contextual,Tabular Q-learning with immediate reward rewritten by fused gravitational and repulsive artificial potential energies per Eqs 2-4 with weights lambda1 lambda2 targeting sparse reward and local optimum issues benchmarks against vanilla Q-learning and classical A-star under simple moderate and complex obstacle densities metrics include path length collision counts convergence time thirty-second collision-free success rate and wall-clock computation deep reinforcement learning cited only peripherally conclusions no physical construction robot trials Procedia SPIoT2024 track open access Elsevier CC BY-NC-ND
32,32,jin2026harnessing,2026,Harnessing Human Expertise,Harnessing Human Expertise for High-Precision Robotic Assembly in Industrialized Construction: A Sample-Efficient Installer-in-the-Loop Interactive Reinforcement Learning Framework,Tier A,Structural Assembly and Installation,Low-level chunked end-effector delta-pose plus binary vacuum command,High-dim multimodal dual-RGB observation (wrist+side 128x128x3) fused with low-dim 18D proprioception (joint states and end-effector pose),POMDP,H/D/H/H,Bounded skill or supervisory,AM2,L0,Primary,"Installer-in-the-loop offline-to-online RL for tolerance-critical window seating with 2 mm per-side clearance in MuJoCo; policy observes dual-view RGB and proprioception and outputs fixed-horizon action chunks (h=10) of 7D controls (6D incremental end-effector pose plus binary vacuum), tracked by an OSC controller. Learning pipeline has three stages: offline demonstration pretraining, non-updating warm-start value calibration, and online fine-tuning with event-driven binary human takeovers at high-risk contact boundaries (binding/wedging/jamming). RL backbone uses chunk-level Q-learning with a flow-based multimodal sequence prior (QC-FQL style teacher-student distillation) under sparse terminal acceptance-aligned reward; replay mixes offline demos and online interactions in matched ratio. Reported simulator stress tests show strong seated success under bounded pose/friction randomization with low cumulative takeover time, but evidence remains simulation-only and explicitly notes no formal deployment safety guarantees."
33,33,kadokawa2025progressive,2025,Progressive-resolution policy distillation,Progressive-resolution policy distillation: Leveraging coarse-resolution simulations for time-efficient fine-resolution policy learning,Tier A,Earthwork and Material Processing,Mid-level,Low-dim structured proprioceptive-plus-perception vector with estimated rock pose from RGB-D camera bucket pose from encoder and binary force-contact state from force sensor excluding raw images and particle fields,MDP,MB/D/MB/MB,Bounded skill or supervisory,AM0,L3,Primary,PRPD curriculum over simulation resolution from coarse to fine with conservative policy transfer via KL regularization and adaptive mixture rate alpha estimated from auxiliary Q function trained with PPO and generalized advantage estimation in Isaac Gym variable-resolution particle simulator with domain randomization sim-to-real on UR5e and nine real rock environments achieves about ninety percent success while reducing sampling time to less than one seventh versus fixed finest-resolution training
34,34,kalousdian2022learning,2022,Learning robotic manipulation natural materials,Learning robotic manipulation of natural materials with variable properties for construction tasks,Tier A,Structural Assembly and Installation,Low-level,Low-dim structured proprioceptive and task-relative observation with goal-direction vector from free end effector or transported bundle tip to target base-link quaternion five joint angles base-link angular velocity base-link linear velocity and finite observation history stack with injected Gaussian sensor noise,POMDP,MB/D/MB/MB,Bounded skill or supervisory,AM0,L3,Primary,Custom five-DoF brachiating mobile robot with force-feedback interlocking claws for bamboo assembly; tasks are reaching and transportation formulated as stochastic partially observable MDPs with policy outputting five joint position target offsets in degrees trained using PPO with asynchronous gradient descent in PhysX simulation of bamboo as rigid-body chains connected by damped oscillators; automatic domain randomization with dynamically adjusted curriculum over mechanical and geometric bamboo parameter ranges expands feasible configuration space while preserving success threshold and improves transfer to unseen configurations compared to fixed randomization; real hardware proof-of-concept demonstrates reaching transport and locomotion on bamboo structures
35,35,kim2026decomposition,2026,Decomposition-based IRL excavator bucket-swing planning,A simulation study of decomposition-based inverse reinforcement learning toward construction automation: The case of excavator in challenging environments,Tier B,"Navigation, Layout, and Logistics Support",High-level,Low-dim / engineered spatial-temporal state representation,MDP,MB/D/MB/MB,Bounded skill or supervisory,AM0,L0,Contextual,"Replacement for removed duplicate/boundary slot. Contextual boundary only: IRL not DRL; simulation-only; discretized high-level excavator actions, not hardware earthwork interaction physics."
36,36,lee2021autonomous,2021,Autonomous construction hoist high-rise,Autonomous construction hoist system based on deep reinforcement learning in high-rise building construction,Tier B,"Navigation, Layout, and Logistics Support",High-level multi-hoist dispatch and floor-serving decisions (discrete go-up go-down stop actions per decision step),Low-dim structured multi-hoist dispatch state per floor with hall-call up/down indicators car-call destination demands and per-hoist current floor direction speed and load-capacity variables (encoded into DQN inputs),MDP,MB/D/MB/MB,Task/planner-level,AM1,L2,Contextual,"Deep Q-network group controller for multiple construction hoists learns discrete dispatch actions in a 30-story multi-hoist simulator with sparse and delayed rewards tied to passenger waiting and lifting times. The trained policy is then validated on a lab-scale mock-up hoist platform synchronized with real-site call datasets using a hardware stack (remote hall-call pagers sensors auto-controller and group controller), showing total transportation-time reductions versus a human-operator model and SCAN/GA/LQF baselines. Assurance is controller-bounded and prototype-level; no independent runtime veto/fallback layer is reported."
37,37,lemouchi2024reinforcement,2024,RL Path Planning Mobile Cranes,Reinforcement Learning-Enhanced Path Planning for Mobile Cranes in Dynamic Construction Environments: A Virtual Reality Simulation Approach,Tier B,Material Placement and Lifting,Mid-level crane motion command policy over tracks/boom/hook DoFs in simulator,Low-dim / structured simulator state with crane and payload pose-velocity-rotation plus sensor-derived collision tags and a payload-connected boolean,MDP,MB/D/MB/MB,Task/planner-level,AM0,L0,Contextual,"VR+RL lift-path planning framework for a crawler mobile crane in a 3D simulated construction site. The agent controls crane components through simplified DoFs: tracks (translation and yaw), boom (rotations), and hook vertical motion; actions are penalized by time/energy proxies (track moves highest penalty, then boom, then hook) while rewards are given for successful pickup and final set-down. State includes element locations, velocities, and local rotations for crane/payload/environment plus sensor-based collision information and a binary indicator of whether payload is attached to the hook. Objective jointly targets reduced lifting time, lower energy-related movement cost, and improved collision avoidance. Training over millions of episodes shows convergence to shorter simulation time and higher cumulative rewards. Reported implementation is proof-of-concept and remains simulation-only; notably, obstacle rigid-body collisions were simplified/removed in the presented experiment to ensure full-run training, so real-site dynamic-obstacle robustness remains unvalidated."
38,38,li2023enhancing,2023,Enhancing construction robot learning GAIL,Enhancing construction robot learning for collaborative and long-horizon tasks using generative adversarial imitation learning,Tier A,Structural Assembly and Installation,Low-level,Low-dim structured multi-robot state with UGV base pose and XY pose differences to arms/window/targets arm joint angles and end-effector-to-window or window-to-target pose deltas plus a small set of boolean task flags; no raw images used as policy input despite VR collection and PyBullet rendering,MDP,MB/D/MB/MB,Bounded skill or supervisory,AM0,L0,Primary,VR-collected expert demonstrations of window transport picking and installation on KUKA iiwa arms and Husky UGV feed GAIL generator-discriminator loop; PPO baselines trained with carefully shaped dense rewards while GAIL infers rewards implicitly from state-action distributions; three long-horizon collaborative subtasks with fixed and randomized variants used for benchmarking; all results are in simulation with no physical robot execution or safety/runtime veto layer described.
39,39,lu2022excavation,2022,Excavation RL geometric representation,Excavation reinforcement learning using geometric representation,Tier A,Earthwork and Material Processing,High-level,"Low-dim geometric state from an RGB-D point cloud: crop to digging-tray range then FPS downsample to 7000 points and feed a PointNet++ representation network trained with geometric supervision (normal, curvature, object counting) to produce a compact 280-D embedding; PPO uses this 280-D embedding as observation (no raw point-cloud end-to-end policy)",MDP,MB/D/MB/MB,Bounded skill or supervisory,AM0,L2,Primary,"PointNet++ geometric representation trained with normal/curvature/object-count supervision and frozen during RL; PPO plans a sequence of attacking poses (x,y,attack angle alpha) using a simplified excavation trajectory template with fixed 5 phases (attacking, digging, dragging, closing, lifting) and fixed closing angle beta and lift height; each action is converted to discretized open-loop joint trajectory via IK with IK/collision failures treated as planning failures; reward is excavated-object volume and episodes execute 10 sequential excavations in sim; direct sim-to-real deployment on physical Franka Panda excavation using RGB-D point clouds demonstrates representation transfer advantage over end-to-end RL on raw point clouds"
40,40,machado2023safe,2023,Safe Crane Handling Collision-Free DDPG,Safe Crane Handling with Collision-Free Path Planning using {DDPG},Tier B,Material Placement and Lifting,Mid-level,High-dim observation,MDP,MB/D/MB/MB,Bounded skill or supervisory,AM0,L0,Contextual,paper-level check: reviewed in prior evidence pass; classification retained after consistency audit.
41,41,matsumoto2020simulation,2020,Simulation-based RL construction machine,Simulation-based reinforcement learning approach towards construction machine automation,Tier A,Earthwork and Material Processing,Mid-level,Low-dim / engineered simulator state,MDP,MB/D/MB/MB,Bounded skill or supervisory,AM0,L0,Primary,This CSV row tracks the hydraulic-excavator soil-loading evaluation only (not mobile boom crane anti-sway in the source).
42,42,mohiuddin2023zero,2023,Zero-shot Sim2Real tower crane,Zero-shot Sim2Real transfer of Deep reinforcement learning controller for tower crane system,Tier B,Material Placement and Lifting,Low-level,Low-dim structured crane-state observation (xg distance-to-goal; x_dot trolley velocity; alpha load-swing angle; alpha_dot load-swing rate),MDP,MB/D/MB/MB,Bounded skill or supervisory,AM1,L2,Contextual,"DDPG (off-policy) continuous controller for tower-crane trolley motion with swing suppression; observations are 4 low-dim states (xg,x_dot,alpha,alpha_dot) and the 1 action is normalized motor voltage V mapped to PWM; OU noise exploration; sample time 0.1 s; reward targets fast trolley arrival with load swing damped to ~0; PI baseline uses small-angle linearization (friction neglected) and tuned gains for trolley and swing; Sim2Real zero-shot transfer is demonstrated on the INTECO TCS hardware using the detailed dynamic model during training (no additional transfer technique reported)."
43,43,molaei2026data,2026,Data-driven rock capture standard excavator,Data-driven rock capture with a standard excavator via model-free reinforcement learning,Tier B,Earthwork and Material Processing,Mid-level,"Low-dim / structured simulator state, rock CoM and excavator state",POMDP,MB/D/MB/MB,Bounded skill or supervisory,AM0,L0,Contextual,Simulator-provided state and rock CoM; partial-state / simulator observable boundary versus full soil/soil-shape state.
44,44,morais2025reinforcement,2025,RL World Models Autonomous Excavation,Reinforcement Learning with World Models for Autonomous Excavation Optimization in Wheel Loaders,Tier B,Earthwork and Material Processing,Mid-level,Low-dim / structured time-series simulator state,MDP,MB/D/MB/MB,Bounded skill or supervisory,AM0,L0,Contextual,LSTM world model trained on Volvo simulator-derived features; imagined PPO rollouts.
45,45,mori2025human,2025,Human-in-the-Loop RL Hydraulic Excavator,Human-in-the-Loop Reinforcement Learning to Track Excavation Paths for a Hydraulic Excavator in a Short Period of Time,Tier A,Earthwork and Material Processing,Mid-level,Low-dim / structured sensor-state and target-path representation,POMDP,H/D/MB/MB,Bounded skill or supervisory,AM2,L3,Primary,Human-in-the-loop partially observed path tracking and world-model path representation.
46,46,osa2022deep,2022,DRL adversarial training excavation depth,Deep reinforcement learning with adversarial training for automated excavation using depth images,Tier A,Earthwork and Material Processing,Mid-level,High-dim observation,MDP,MB/D/MB/MB,Bounded skill or supervisory,AM0,L0,Primary,Depth-image based excavation perception (high-dim).
47,47,osa2023learning,2023,Learning adaptive policies excavation soil,Learning adaptive policies for autonomous excavation under various soil conditions by adversarial domain sampling,Tier A,Earthwork and Material Processing,Mid-level,High-dim observation,MDP,MB/D/MB/MB,Bounded skill or supervisory,AM0,L0,Primary,Adversarial/domain sampling coded as training-side robustness under manuscript A4 rules; no disclosed execution-time assurance.
48,48,ozaki2024blade,2024,Blade control bulldozer RL,Blade control for bulk dozer push by bulldozer using reinforcement learning,Tier A,Earthwork and Material Processing,Mid-level,High-dim observation,MDP,MB/D/MB/MB,Bounded skill or supervisory,AM0,L0,Primary,Reward shaping and simulator failure resets do not imply active execution-time AM2 mediation under A4 coding rules.
49,49,parisi2024new,2024,A New Concept for Large Additive Manufacturing,A New Concept for Large Additive Manufacturing in Construction: Tower Crane-Based {3D} Printing Controlled by Deep Reinforcement Learning,Tier B,Additive Manufacturing and Surface Processing,Low-level continuous actuator control (jib angular increment u_a_t and aero-pendulum thrust force F_t),Low-dim structured continuous state vector (relative perpendicular extruder-trolley p_t p_dot p_ddot; previous angular increment u_a_prev; thrust F_t; trolley angle u_t; trolley global x y plus velocities/accelerations x_dot y_dot x_ddot y_ddot),MDP,MB/D/MB/MB,Bounded skill or supervisory,AM0,L0,Contextual,"TD3 actor-critic continuous control for TC-based 3D printing using Simscape Multibody; action is {u_a_t, F_t} with bounded ranges (u_a_t in [0.005..0.2] and F_t in [-300..300] N); observation is a structured vector with relative extruder-trolley perpendicular dynamics plus trolley global pose and derivatives (p_t p_dot p_ddot u_a_t F_t u_t x y x_dot y_dot x_ddot y_ddot); simulated discrete-time MDP with dt = 0.1 s and horizon T = 60 s; reward encourages fast trajectory following while suppressing swing: r_t = u_a_prev * 25/(1+1e8 p_t); training uses minibatch 512 and replay buffer 1e6 (actor lr 1e-4 critic lr 1e-3 discount 0.99) with roughly 5000 simulation episodes; evaluated against an uncontrolled case under externally applied disturbance forces on the extruder (d(t)=A*sin(f*t+phi)+b with A in [-200..200] N and f in [6.28..62.8] rad/s and phi in [0..0.35] rad and b in [0..30] N); controlled case achieves Eurocode 6 EN 1996-2 tolerances with max abs error about 0.08 m and mean abs error about 0.045 m (uncontrolled abs error up to about 0.99 m)."
50,50,poudel2025slam,2025,SLAM-Assisted Transformer-Based TD3 DRL,SLAM-Assisted Transformer-Based {TD3} Deep Reinforcement Learning for Adaptive Navigation and Mapping and Dynamic Obstacle Avoidance in Autonomous Construction Robotics,Tier B,"Navigation, Layout, and Logistics Support",Mid-level,High-dim / SLAM occupancy-grid and pose representation,MDP,MB/D/MB/MB,Bounded skill or supervisory,AM0,L0,Contextual,Real-time occupancy grids and pose estimates plus transformer TD3 obstacle avoidance policy.
51,51,shen2024generalized,2024,Generalized Framework for Wheel Loader Automatic Shoveling Task,Generalized Framework for Wheel Loader Automatic Shoveling Task with Expert Initialized Reinforcement Learning,Tier A,Earthwork and Material Processing,Low-level continuous joint position targets (boom and bucket trajectory setpoints),Low-dim / structured joint state and target-distance (theta_boom theta_bucket theta_dot_boom theta_dot_bucket dr),MDP,MB/D/MB/MB,Bounded skill or supervisory,AM2,L3,Primary,"CoL (Circle of Learning) expert-initialized TD3 for fast wheel-loader bucket shoveling; actor outputs continuous boom and bucket position targets while an inverse-dynamics controller tracks them using estimated dynamics B(q) qdd + C(q,q_dot) q_dot + tau_f(q_dot) + g; hydraulic dead-zones are cut from valve-command data and remaining non-linear effects are modeled as Coulomb + viscous friction; states are [theta_boom theta_bucket theta_dot_boom theta_dot_bucket dr] where dr is relative distance from bucket tip to pile edge measured by GNSS and joint kinematics measured by IMUs; reward is zero until bucket penetration then combines a completion term lambda1(1-tanh(d_end)) and a fill-rate term lambda2(V/Vmax) evaluated only at the last two steps of each 100-step episode (dt=0.01s); simulation uses NVIDIA Isaac Gym (PhysX) with cube sand particles and domain randomization on observation noise mu(0,0.002) and pile friction in [0.2,0.9]; pretraining uses 10 expert demonstrations with behavior-cloning loss LBC plus L2 regularization then switches to off-policy CoL/TD3 updates from replay; training takes about 2 hours on CPU and reaches avg fill rate about 89.8% vs TD3 about 20.6% within the same duration (expert about 80%); real experiments on MUSTANG 2040 validate sim-2-real with wet soil avg fill rate about 95% and medium coarse gravel avg about 88% (two safety terminations) and show close boom and bucket trajectory matching, with remaining trajectory roughness attributed to uncertain bucket-media interactions (pressure sensing or better interaction models suggested)."
52,52,shin2025adaptive,2025,Adaptive Excavation Automation Complex Soil,Adaptive Excavation Automation in Complex Soil Environments Using Reinforcement Learning,Tier A,Earthwork and Material Processing,Mid-level,Low-dim / structured soil-parameter and excavation-state representation,MDP,MB/D/MB/MB,Bounded skill or supervisory,AM0,L0,Primary,paper-level check: PPO state uses FEE soil parameters and grid/height summary variables rather than raw high-dimensional perception.
53,53,spinelli2026large,2026,Large-Scale Robotic Material Handling,"Large-Scale Robotic Material Handling: Learning, Planning, and Control",Tier A,Earthwork and Material Processing,Mid-level,Low-dim / engineered 2.5D soil heightmap (hsoil) for attack-point planning + proprioceptive joint state and action/velocity history for waypoint-following/throwing (tube-distance and inferred binary gripper open/close),POMDP,MB/D/MB/MB,Bounded skill or supervisory,AM2,L4,Primary,"Full framework for autonomous bulk material handling with grasp-and-dump cycles on a fixed-base 40 t hydraulic material handler. RL modules: (1) attack-point planner (PPO) outputs a 3D grasp attack point to maximize scooped volume / minimize number of cycles, operating on an engineered heightmap hsoil derived from filtered pile geometry; policy input is flattened hsoil (optionally bicubic-interpolated to coarser grids) with observation-noise models (sensor Gaussian noise, LiDAR dropout/spikes simulated during training) and domain-randomized pile initializations. (2) waypoint-following controller (PPO) tracks provided waypoint sequences with bounded deviation via tube constraints and minimizes oscillations of a free-swinging underactuated clamshell gripper; action includes direct slew joystick command plus boom/stick velocity references, constrained by actuator-range clipping and using a history window of actions/velocities to infer latent dynamics. (3) throwing controller extends waypoint-following by adding a binary gripper open action (with simulated release delay) and compensating for granular release by training on discrete sequential rigid loads L1–L3 (parabolic trajectories with tool-oscillation-dependent spread), rewarding accurate final throw while continuing tube/safety terms. Low-level control: boom/stick track velocity references via PI + LUT feedforward; slew dynamics are learned via a hybrid data-driven pressure-to-velocity model (two-stage MLPs) integrated into simulation; gripper oscillation modeled as a double-pendulum with dissipative term. Simulation/training: RaiSim with 512 parallel environments (sim 50 Hz, control 10 Hz), 15 s episodes, multiple PPO updates and history-dependent observations; domain randomization includes hydraulic delay/friction/inertia and initial joint configurations. Safety & execution: obstacle-aware arm path planning uses OctoMap + RRT* and updates every phase change inside a high-level state machine (WAYPOINT/GRASP/THROW), with additional joint-limit safety layer and STOP on failure; RL controllers enforce bounded tracking within the tube for safe motion in cluttered workspaces. Evidence: real-world experiments validate two tasks (bulk pile management and dump-truck loading), comparing against human operators for precision/repeatability/safety; residual sim-to-real errors mainly attributed to slew/model mismatch and uncontrolled granular free-fall after release."
54,54,taheri2024end,2024,End-effector cartesian velocity loader cranes,End-effector cartesian velocity control for redundant loader cranes using reinforcement learning,Tier B,Material Placement and Lifting,Mid-level,Low-dim / structured joint-state and line-tracking error representation,MDP,MB/D/MB/MB,Bounded skill or supervisory,AM1,L2,Contextual,paper-level check: RL policy uses kinematic state variables and tracking error terms; real loader-crane testbed evidence supports L2 but not field-operational exposure.
