row_id,tsv_seq,citation_key,year,title,full_name,final_tier,A1_competency_regime,A2_action_abstraction,A2_observation_type,A2_decision_formalism,A3_SPAE_pattern,A3_authority_pattern,A4_assurance_mode,A5_EVL,synthesis_set,_alias_note
55,55,tan2025reinforcement,2025,RL trajectory planning excavator trenching,Reinforcement learning-based trajectory planning for continuous digging of excavator working devices in trenching tasks,Tier A,Earthwork and Material Processing,Mid-level,Low-dim / structured joint-state and task-geometry representation,MDP,MB/D/MB/MB,Bounded skill or supervisory,AM0,L0,Primary,"paper-level check: TD3 state observation is compact engineered variables (joint kinematics/jerk, power-torque, target-area geometry and excavation-rate terms), not raw high-dimensional perception; safety handling is reward/termination shaping without a distinct runtime intervention layer."
56,56,cho2026collaborative,2026,Collaborative learning architecture for autonomous excavator planning and execution,Collaborative learning architecture for autonomous excavator planning and execution,Tier A,Earthwork and Material Processing,Mid-level,High-dim / gridmap plus structured kinematic-state representation,MDP,MB/D/MB/MB,Bounded skill or supervisory,AM0,L0,Primary,paper-level check: hierarchical CLEF couples RL excavation-target planning with A-GAIL trajectory execution for excavator operations; observations include gridmap terrain state and engineered joint/error/soil variables; assurance is learning/feedback-based without a distinct runtime intervention shield.
57,57,tarutani2020accuracy,2020,Accuracy Trained Models Lift Planning,Accuracy and Generality of Trained Models for Lift Planning Using Deep Reinforcement Learning-Optimization of the Crane Hook Movement between Two Points,Tier A,Material Placement and Lifting,Mid-level,Low-dim / structured crane-hook kinematic state representation,MDP,MB/D/MB/MB,Bounded skill or supervisory,AM0,L0,Primary,"paper-level check: Unity ML-Agents policy uses engineered state variables (hook/target coordinates, vectors, speeds) rather than raw image or point-cloud observations."
58,58,wu2025robot,2025,Robot in the loop human-centered,Robot in the loop: a human-centered approach to contextualizing {AI} and robotics in construction,Tier A,"Navigation, Layout, and Logistics Support",Mid-level,High-dim / multi-modal perception plus structured social-navigation state,POMDP,H/D/MB/MB,Bounded skill or supervisory,AM1,L3,Primary,paper-level check: construction-floor prototype combines RGB-D and LiDAR perception with DRL social navigation; includes worker-facing summon/send/accompany controls and real-world comfort-focused evaluation.
59,59,xiao2025_modular,2025,Autonomous modular construction robotized crane,Autonomous modular construction strategy using robotized crane based on deep learning and reinforcement learning,Tier A,Material Placement and Lifting,Mid-level,High-dim / vision-based container detection plus structured crane-state representation,MDP,MB/D/MB/MB,Bounded skill or supervisory,AM0,L0,Primary,paper-level check: YOLOv5-S is used for modular container image detection/localization and PPO-I for collision-free crane motion planning in virtual construction environments.
60,60,xiao2025autonomous,2025,Autonomous construction framework crane SAC,Autonomous construction framework for crane control with enhanced soft actor--critic algorithm and real-time progress monitoring,Tier A,Material Placement and Lifting,Mid-level,Low-dim / structured crane-state and obstacle-geometry representation,MDP,MB/D/MB/MB,Bounded skill or supervisory,AM2,L3,Primary,paper-level check: SAC-E policy consumes engineered crane/object/obstacle state variables with sensor feedback and executes on a robotized mobile crane; real-time BIM-linked monitoring and emergency-stop governance support construction-representative exposure.
61,61,ye2025eulerian,2025,Eulerian Circuit-Based RL Path Optimization,A Eulerian Circuit-Based Reinforcement Learning Path Optimization Method for {3D} Concrete Printing,Tier B,Additive Manufacturing and Surface Processing,Low-level discrete next-edge selection along the Eulerian graph (Q-learning at branching points),Low-dim / engineered discrete traversal state (current point index among 15600; branching/non-branching + forward-only constraint),MDP,MB/D/MB/MB,Bounded skill or supervisory,AM0,L0,Contextual,"3D concrete printing slice is treated as graph traversal: 15600 discretized points form the RL environment state; 32 branching points are the decision vertices while non-branching points are visited once and enforce forward-only motion (no reverse). Fleury algorithm first generates multiple Eulerian circuits from the same start vertex; RL (tabular Q-learning) optimizes which next-edge/next branching choice to follow along those circuits. Reward is distributed to guide global behavior: positive reward at branching states with higher value rb<=re when the agent follows the Eulerian circuit order; turning penalty Rt(s,a) applies negative reward when the printhead changes direction/action (reducing turning and lift/start-stop). Training uses epsilon-greedy with linearly decayed epsilon from 0.3 to 0.05 and terminates after exhaustive traversal with no redundancy (unvisited list becomes empty). Reported outcome for N=13: non-print ratio becomes zero (one-stroke Eulerian traversal), turning times reduced by 20.2% vs Eulerian circuit baseline; lifting times reduced by 59.6% vs ZigZag and by 36.3% vs Eulerian. Gains increase as geometry complexity grows; paths exhibit regular sub-path structure beneficial for subsequent G-code digitization/standardization."
62,62,zeng2025reinforcement,2025,RL Assisted Robotic Masonry Block,Reinforcement Learning Assisted Robotic Construction for Masonry Block Dry-Stacking in Simulation Environments,Tier B,Structural Assembly and Installation,Mid-level,Low-dim / structured end-effector–block and block–target state representation,MDP,MB/D/MB/MB,Bounded skill or supervisory,AM0,L0,Contextual,paper-level check: PPO-based robot-arm dry-stacking is validated in PyBullet/Gym simulation only; policy inputs are engineered distance/state variables rather than raw high-dimensional perception and no distinct runtime intervention layer is disclosed.
63,63,zhu2021deep,2021,DRL prefab assembly planning,Deep reinforcement learning for prefab assembly planning in robot-based prefabricated construction,Tier B,Structural Assembly and Installation,Mid-level,Low-dim / structured grid-state and component-status tensor representation,MDP,MB/D/MB/MB,Task/planner-level,AM0,L0,Contextual,paper-level check: CASE 2021 study formulates prefab assembly planning in a simulated pygame/OpenGL environment with DQN variants; observations are engineered state tensors and evidence remains simulation-only without independent runtime safety intervention.
64,64,zhu2022excavation,2022,Excavation fragmented rocks multi-modal,Excavation of fragmented rocks with multi-modal model-based reinforcement learning,Tier A,Earthwork and Material Processing,Mid-level,High-dim / multi-modal visual-tactile-proprioceptive state with structured robot pose-force history,MDP,MB/D/MB/MB,Bounded skill or supervisory,AM2,L2,Primary,"paper-level check: IROS 2022 method learns RNN dynamics from physical excavation data and performs MPC over discrete excavation primitives using RGB, contact-force, and proprioceptive feedback to avoid jamming while tracking a reference path."
65,65,zhu2023deep,2023,DRL real-time assembly planning,Deep reinforcement learning for real-time assembly planning in robot-based prefabricated construction,Tier B,Structural Assembly and Installation,High-level,Low-dim / BIM-simulator structured state,MDP,MB/D/MB/MB,Task/planner-level,AM0,L0,Contextual,paper-level check: TASE 2023 extends the CASE 2021 simulator-based prefab assembly-planning line with broader benchmark scenarios and DRL comparisons; evidence remains simulation-only planning support without physical robot deployment validation.
66,66,gannouni2023tunnelring,2023,Experimental Digital Twin Tunnel Ring,Experimental Digital Twin of a Tunnel Ring Building Erector,Tier B,Structural Assembly and Installation,Mid-level,Low-dim structured state,MDP,MB/D/MB/MB,Bounded skill or supervisory,AM0,L0,Contextual,paper-level check: EUROCON 2023 EDT studies PPO control learning for tunnel-segment placement in a MuJoCo simulation with collision-aware rewards; evidence is simulation-only and discusses future transfer under safety constraints without physical deployment validation.
67,67,balazy2024reinforcement,2024,RL Overhead Crane Sensor-Failure,Reinforcement Learning-Based Overhead Crane Control for Handling in Sensor-Failure Scenarios,Tier B,Material Placement and Lifting,Mid-level,Low-dim / estimated crane-state observation under sensor-failure,POMDP,MB/D/MB/MB,Residual learning within classical control,AM0,L0,Contextual,paper-level check: ICCC 2024 learns feedback gains for overhead-crane control from estimated states in sensor-failure scenarios; robustness is demonstrated in simulation without a distinct runtime intervention shield.
68,68,yi2024substructure,2024,Substructure-Preserving Generalization,Substructure-Preserving Generalization for on-site robotic construction planning,Tier B,Structural Assembly and Installation,High-level,Low-dim graph/structured state,MDP,MB/D/MB/MB,Task/planner-level,AM0,L0,Contextual,paper-level check: ISCIPT 2024 proposes offline RL and graph-transformer composition for bridge-construction planning in PyBullet with randomized block lengths and cliff distances; results are simulator-only generalization benchmarks without physical deployment evidence.
69,69,ning2025cooperative,2025,Cooperative Relaying Construction Equipment Networks,Cooperative Relaying for Connected Construction Equipment Networks With Hybrid Hierarchical Proximal Policy Optimization,Tier B,"Navigation, Layout, and Logistics Support",High-level,Low-dim network state,MDP,MB/D/MB/MB,Task/planner-level,AM0,L0,Contextual,paper-level check: TCOMM 2025 studies NR-V2X cooperative relay strategy optimization for tunnel construction-equipment networks via HH-PPO under mixed action space; evidence is simulation-based communication-planning performance without embodied robot control deployment.
70,70,ishihara2024mpc,2024,Controlling Autonomous Machines MPC,Controlling Autonomous Machines at Construction Sites with Heterogeneous Moving Objects by Model Predictive Control,Tier B,"Navigation, Layout, and Logistics Support",Mid-level,Low-dim / structured multi-agent kinematic-state and predicted-trajectory observation,N/A,MB/MB/MB/MB,Non-RL model-based control contextual,AM0,L0,Contextual,paper-level check: SMC 2024 uses unified NMPC for autonomous excavator and dump truck with explicit collision-avoidance constraints and simple human-operated machine trajectory prediction; evidence is numerical simulation without hardware deployment.
71,71,saffari2025miniature,2025,Robotization Miniature-Scale Radio-Controlled Excavator,Robotization of Miniature-Scale Radio-Controlled Excavator: A New Medium for Construction- Specific DNN Data Generation,Tier B,Earthwork and Material Processing,Low-level,Low-dim / structured joint-kinematic and PWM-command observation,N/A,MB/MB/MB/MB,Non-RL robotization/data-generation platform,AM0,L1,Contextual,paper-level check: IEEE Access 2025 presents robotization and motion-model validation of a miniature RC excavator for automated data labeling and future RL experimentation; evidence is controlled laboratory platform validation rather than deployed excavation task autonomy.
72,72,bandong2025prpgantry,2025,PRP-Gantry Crane Neural IDA-PBC,Modeling and Control of PRP-Gantry Crane Systems via Neural IDA-PBC,Tier B,Material Placement and Lifting,Mid-level,Low-dim / structured PRP-GC state and parameter observation,N/A,MB/MB/MB/MB,Non-RL neural/passivity-based control contextual,AM0,L0,Contextual,paper-level check: T-ITS 2025 develops PINN-assisted Neural IDA-PBC for underactuated PRP-gantry crane sway and position regulation with Monte Carlo robustness simulation; this is non-RL control-theoretic validation without runtime intervention shield.
73,73,laksana2025navigating,2025,Navigating Vision-based Autonomous Excavator,Navigating Vision-based Autonomous Excavator Robot Using Deep Reinforcement Learning,Tier B,"Navigation, Layout, and Logistics Support",Mid-level,Low-dim perception-derived state,MDP,MB/D/MB/MB,Bounded skill or supervisory,AM0,L0,Contextual,paper-level check: EECSI 2025 uses PPO with YOLOv8n for camera-guided autonomous excavator navigation in Webots simulation; reports task success and angle errors but does not provide physical deployment validation.
74,74,xu2019feedbackddpg,2019,Feedback DDPG Fuzzy Reward Peg-in-Hole,Feedback Deep Deterministic Policy Gradient With Fuzzy Reward for Robotic Multiple Peg-in-Hole Assembly Tasks,Tier B,Structural Assembly and Installation,Mid-level,Low-dim / structured pose-force-moment state observation,MDP,MB/D/MB/MB,Residual learning within classical control,AM1,L2,Contextual,"paper-level check: TII 2019 combines MDDPG with fuzzy reward and feedback exploration guided by classical force control, demonstrating contact-rich dual peg-in-hole performance in simulation and lab experiments; strong method evidence but generic industrial context."
75,75,luo2019variableimpedance,2019,RL Variable Impedance Controller High-Precision,Reinforcement Learning on Variable Impedance Controller for High-Precision Robotic Assembly,Tier B,Structural Assembly and Installation,Mid-level,Low-dim / structured robot-state plus force-torque observation,MDP,MB/D/MB/MB,Residual learning within classical control,AM1,L2,Contextual,"paper-level check: ICRA 2019 combines iLQG-based RL with operational-space force/torque control for tight-tolerance assembly, showing simulation and physical robot validation with variable impedance behavior; strong contact-rich evidence in generic industrial context."
76,76,li2019manipulationskill,2019,Manipulation Skill Acquisition Assembly,Manipulation Skill Acquisition for Robotic Assembly using Deep Reinforcement Learning,Tier B,Structural Assembly and Installation,Low-level,Low-dim / structured joint-state plus force-torque observation,MDP,MB/D/MB/MB,Bounded skill or supervisory,AM1,L2,Contextual,paper-level check: AIM 2019 trains DDPG directly on a real KUKA iiwa fasten-assembly task with joint/pose/force-torque state and explicit torque-limit safety constraints; demonstrates lab-scale physical validation but remains contextual evidence for construction robotics.
77,77,strickland2019multirobot,2019,A reinforcement learning approach to multi-robot planar construction,A Reinforcement Learning Approach to Multi-Robot Planar Construction,Tier B,"Navigation, Layout, and Logistics Support",High-level,Low-dim / local scalar-field plus puck-contact state,MDP,MB/D/MB/MB,Task/planner-level,AM0,L0,Contextual,paper-level check: MRS 2019 studies decentralized tabular Q-learning for multi-robot planar shape formation in a custom 2D simulator using local scalar-field and puck sensors; evidence is simulation-only collective construction planning without physical construction-robot deployment.
78,78,jin2021sharedcontrol,2021,Task Learning Intent Prediction Blended Shared Control,"Task Learning, Intent Prediction, and Adaptive Blended Shared Control With Application to Excavators",Tier B,Earthwork and Material Processing,Mid-level,Low-dim / structured joint-state plus operator-input intent features,POMDP,H/D/H/H,Bounded shared control,AM2,L2,Contextual,paper-level check: TCST study learns subgoals from skilled demonstrations and performs intent-aware blended shared control with conflict-awareness on a scaled hydraulic excavator for earth-moving with novice operators; strong lab human-in-the-loop evidence but not autonomous field deployment.
79,79,kurinov2020automatedexcavator,2020,Automated Excavator RL Multibody System Dynamics,Automated Excavator Based on Reinforcement Learning and Multibody System Dynamics,Tier B,Earthwork and Material Processing,Low-level,Low-dim / structured multibody-hydraulic state and task-progress observation,MDP,MB/D/MB/MB,Bounded skill or supervisory,AM0,L0,Contextual,"paper-level check: IEEE Access 2020 trains PPO-CMA to control a simulated excavator with multibody dynamics, hydraulic actuators, and deformable soil for hopper loading; despite high-fidelity physics, evidence is simulation-only with no physical excavator deployment validation."
80,80,bui2022disturbance,2022,Disturbance-Observer RL Overhead Crane,Disturbance-Observer based Reinforcement Learning for Overhead Crane Systems,Tier B,Material Placement and Lifting,Low-level,Low-dim / structured crane-state and tracking-error observation,POMDP,MB/D/MB/MB,Residual learning within classical control,AM1,L0,Contextual,paper-level check: ICCAIS 2022 presents disturbance-observer-enhanced ADP/RL control for a 2D overhead crane with Lyapunov analysis and numerical simulation only; evidence is control-theoretic and simulation-based without physical construction lifting deployment.
81,81,brosque2020opportunities,2020,Human-robot collaboration construction,Human-Robot Collaboration in Construction: Opportunities and Challenges,Tier B,Structural Assembly and Installation,Mid-level,Low-dim / structured visual-haptic teleoperation state,POMDP,H/D/H/H,Bounded skill or supervisory,AM1,L1,Contextual,"paper-level check: this is an HRC opportunities/method framing paper (simulation-centric with selected lab/hardware haptic demonstrations across drywall/painting/bolting/welding/pouring scenarios), not a standalone deep-RL construction deployment study; keep as contextual authority and exclude from retained DRL system-instance denominator."
82,82,cai2022reinforcement,2022,RL approach multiple tasks virtual construction,A reinforcement learning based approach for conducting multiple tasks using robots in virtual construction environments,Tier B,Structural Assembly and Installation,Low-level,Low-dim / structured 6-DoF arm and goal-relative pick-place observation with Unity virtual ray-cast subtask signals,MDP,MB/D/MB/MB,Bounded skill or supervisory,AM0,L0,Primary,paper-level check: curriculum-learning PPO with extrinsic plus curiosity intrinsic rewards in Unity ML-Agents VCE trains one policy generalizing across flooring window and ceiling panel installation pick-place variants; evaluation is simulation-only with ~80% average success and no disclosed independent runtime veto or fallback layer.
83,83,wang_transfer_2025,2025,Transfer RL digital-twin task allocation HRC,A transfer reinforcement learning and digital-twin based task allocation method for human-robot collaboration assembly,Tier B,Structural Assembly and Installation,High-level,Low-dim / structured agent-state and task-execution feature observation,POMDP,H/D/H/H,Task/planner-level,AM0,L2,Contextual,paper-level check: Engineering Applications of AI 2025 proposes transfer multi-agent RL with digital-twin/AR simulation for HRC assembly task allocation and validates decisions with real HRC assembly experiments; strong method evidence in manufacturing assembly context but not construction-site deployment.
84,84,cao_reinforcement_2024,2024,RL Smart Mobile Factory Operation,Reinforcement Learning for Smart Mobile Factory Operation in Linear Infrastructure Projects,Tier B,"Navigation, Layout, and Logistics Support",High-level,Low-dim / structured project-state and mobile-factory operation observation,MDP,MB/D/MB/MB,Task/planner-level,AM0,L0,Contextual,paper-level check: ISARC 2024 optimizes mobile-factory scheduling/relocation policy for linear infrastructure via RL in a simulated planning environment; this is logistics-level decision support rather than embodied construction robot execution and has simulation-only validation.
85,85,chandramouli_construction_2025,2025,Construction robot skill learning fragile object,Construction Robot Skill Learning for Fragile Object Installation with Low-Effort Demonstration and Sample-Efficient Hierarchical Reinforcement Learning Models,Tier B,Structural Assembly and Installation,Low-level,Low-dim / structured joint-state plus collision-force observation,POMDP,MB/D/MB/MB,Bounded skill or supervisory,AM0,L0,Contextual,"paper-level check: the study develops force-aware hierarchical RL and validates mainly in MuJoCo simulation for fragile panel installation skill learning; despite construction relevance, evidence is simulation-only without independent runtime safety intervention or field deployment."
86,86,cramer2025cheq,2025,Cheq-ing the box safe variable impedance,Cheq-ing the box: Safe variable impedance learning for robotic polishing,Tier B,Additive Manufacturing and Surface Processing,Mid-level,Low-dim / structured joint-state plus force and path-tracking-error observation,POMDP,MB/D/MB/MB,Residual learning within classical control,AM1,L2,Contextual,"paper-level check: IFAC 2025 demonstrates adaptive hybrid RL (CHEQ) for variable-impedance robotic polishing with direct hardware training (8 hours, 5 failures); evidence is strong for contact-rich manipulation methodology but remains non-construction and is kept contextual."
87,87,dos_santos_autonomous_2013,2013,Autonomous construction of structures dynamic,Autonomous Construction of Structures in a Dynamic Environment using Reinforcement Learning,Tier B,Structural Assembly and Installation,Mid-level,Low-dim / structured robot-pose and assembly-state observation,POMDP,MB/D/MB/MB,Bounded skill or supervisory,AM0,L2,Contextual,paper-level check: this pre-deep-RL study uses learning automata plus heuristic path planning for quadrotor-based truss assembly and reports hardware demonstration in a controlled environment; evidence is historically important but remains contextual relative to modern DRL construction autonomy.
88,88,duan2025enhancing,2025,Enhancing construction robot collaboration MARL,Enhancing construction robot collaboration via multiagent reinforcement learning,Tier B,"Navigation, Layout, and Logistics Support",Low-level,Low-dim / structured multi-agent joint-state and task-geometry observation,POMDP,MB/D/MB/MB,Bounded skill or supervisory,AM0,L0,Primary,"paper-level check: JIC 2025 presents multiagent PPO-based control for collaborative construction robot tasks in PyBullet simulation with IK-assisted precise installation; evidence is construction-relevant but simulation-only, without physical deployment or independent runtime safety intervention layer."
89,89,hoeller2021learning,2021,Learning state representation navigation cluttered,【1】Learning a state representation and navigation in cluttered and dynamic environments,Tier B,"Navigation, Layout, and Logistics Support",Mid-level,Low-dim / learned latent depth-state representation,POMDP,MB/D/MB/MB,Bounded skill or supervisory,AM0,L2,Contextual,"paper-level check: IEEE RA-L 2021 demonstrates sim-to-real local navigation with learned state representation on ANYmal using depth sensing in cluttered dynamic environments; strong robotics methodology evidence with real-robot validation, but non-construction domain and retained as contextual background."
90,90,huang2022deep,2022,DRL construction robots collaboration sequential,Deep reinforcement learning-based construction robots collaboration for sequential tasks,Tier B,Structural Assembly and Installation,Low-level,Low-dim / structured multi-robot joint-state and task-geometry observation,POMDP,MB/D/MB/MB,Bounded skill or supervisory,AM0,L0,Primary,paper-level check: two RL-trained robots (UGV transport + arm installation) are coordinated sequentially for window panel transport-and-installation in simulation with end-to-end inference; construction-relevant but simulation-only evidence without physical deployment.
91,91,ishmatuka2023autonomous,2023,Autonomous pick-and-place excavator,Autonomous pick-and-place using excavator based on deep reinforcement learning,Tier B,Earthwork and Material Processing,Low-level,Low-dim / structured joint-state and bucket pose-error observation,POMDP,MB/D/MB/MB,Bounded skill or supervisory,AM0,L0,Primary,paper-level check: ICITEE 2023 trains PPO in PyBullet for excavator bucket pick-and-place using proprioceptive and pose-error states; construction-relevant control evidence is simulation-only without physical deployment.
92,92,kiemel2019paintrl,2019,Paintrl Coverage path planning industrial spray,Paintrl: Coverage path planning for industrial spray painting with reinforcement learning,Tier B,Additive Manufacturing and Surface Processing,High-level,Low-dim / structured coverage-state sector observation,MDP,MB/D/MB/MB,Task/planner-level,AM0,L0,Contextual,paper-level check: PaintRL studies spray-coverage path planning in PyBullet and uses projection mapping for sim2real visualization/data collection concepts; evidence is simulation-centric for non-construction industrial finishing and retained as contextual methodology.
93,93,Kim2025896,2025,Enhanced Hydraulic Excavator Semi-automatic Grading,Enhanced Hydraulic Excavator Control via Semi-automatic Grading Control Using Reinforcement Learning,Tier B,Earthwork and Material Processing,Low-level,Low-dim / structured joint-angle-cylinder-velocity and joystick-history observation,POMDP,MB/D/MB/MB,Bounded skill or supervisory,AM0,L0,Primary,"paper-level check: IJCAS 2025 combines kinematics-based semi-automatic grading control, supervised inverse hydraulic modeling, and PPO-based arm-joystick optimization on a simplified 30-ton excavator simulator; evidence is construction-specific but simulation-only without independent runtime intervention layer."
